{
  "schema_version": 1,
  "catalog_id": "stellaris-ste",
  "game_id": "stellaris",
  "revision": 2,
  "assets": [
    {
      "dlc_id": "dlc001",
      "asset_name": "dlc001_symbols_of_domination.zip",
      "size": 525,
      "sha256": "e08271314af7ad5e1bad81fae823cfda7d5aa283f1029340de2650e48a8738fe",
      "min_game_version": "4.4.0",
      "max_game_version": "4.4.99",
      "distribution_authorized": false
    }
  ],
  "signature": {
    "key_id": "unsigned-draft",
    "value": "UNSIGNED_DRAFT_REQUIRES_PUBLISHER_SIGNATURE_0000000000000000"
  }
}
