{
  "schema_version": 1,
  "catalog_id": "stellaris-ste",
  "game_id": "stellaris",
  "revision": 1,
  "assets": [
    {
      "dlc_id": "dlc001",
      "asset_name": "dlc001_symbols_of_domination.zip",
      "size": 525,
      "sha256": "0e7839b01a3ccd1c4c77c03a45b084c96526ead16f7fa12906ec99f1e0e3a103",
      "min_game_version": null,
      "max_game_version": null,
      "distribution_authorized": true
    }
  ],
  "signature": {
    "key_id": "unsigned-draft",
    "value": "UNSIGNED_DRAFT_REQUIRES_PUBLISHER_SIGNATURE_0000000000000000"
  }
}
