{
  "schema_version": 1,
  "catalog_id": "stellaris-ste",
  "game_id": "stellaris",
  "revision": 1,
  "assets": [
    {
      "dlc_id": "dlc001",
      "asset_name": "dlc001_symbols_of_domination.zip",
      "size": 525,
      "sha256": "b542736996b2467c548ead1eea8c383568e11b89df83ecb8700ef1a7229f86da",
      "min_game_version": null,
      "max_game_version": null,
      "distribution_authorized": true
    }
  ],
  "signature": {
    "key_id": "unsigned-draft",
    "value": "UNSIGNED_DRAFT_REQUIRES_PUBLISHER_SIGNATURE_0000000000000000"
  }
}
